{
  "$schema": "https://json-schema.org/draft/2020-12/schema",
  "$id": "https://raw.githubusercontent.com/AIAllTheThingz/Public-Access-Agents/main/schemas/v1/project-manifest.schema.json",
  "title": "Project Standards Manifest",
  "description": "Declares the selected project profile, languages, disciplines, platforms, frameworks, risk, exceptions, and project-specific composition metadata.",
  "type": "object",
  "additionalProperties": false,
  "required": [
    "name",
    "profile",
    "languages",
    "disciplines"
  ],
  "properties": {
    "name": {
      "type": "string",
      "minLength": 1
    },
    "profile": {
      "type": "string",
      "minLength": 1
    },
    "secondaryProfiles": {
      "type": "array",
      "items": {
        "type": "string",
        "minLength": 1
      },
      "uniqueItems": true
    },
    "languages": {
      "type": "array",
      "items": {
        "type": "string",
        "minLength": 1
      },
      "minItems": 1,
      "uniqueItems": true
    },
    "disciplines": {
      "type": "array",
      "items": {
        "type": "string",
        "minLength": 1
      },
      "uniqueItems": true
    },
    "platforms": {
      "type": "array",
      "items": {
        "type": "string",
        "minLength": 1
      },
      "uniqueItems": true
    },
    "frameworks": {
      "type": "array",
      "items": {
        "type": "string",
        "minLength": 1
      },
      "uniqueItems": true
    },
    "risk": {
      "enum": [
        "low",
        "moderate",
        "high",
        "critical"
      ]
    },
    "exceptions": {
      "type": "array",
      "items": {
        "type": "string",
        "minLength": 1
      },
      "uniqueItems": true
    },
    "owners": {
      "type": "array",
      "items": {
        "type": "string",
        "minLength": 1
      },
      "uniqueItems": true
    },
    "evidenceLocation": {
      "type": "string",
      "minLength": 1
    },
    "schemaVersion": {
      "type": "string",
      "const": "1.0.0",
      "description": "Optional explicit instance contract version. Omitted legacy instances are interpreted as version 1.0.0."
    },
    "extensions": {
      "type": "object",
      "description": "Namespaced extension data. Extension keys must be organization- or product-specific and must not redefine standard fields.",
      "propertyNames": {
        "pattern": "^[A-Za-z][A-Za-z0-9_.-]{1,127}$"
      },
      "additionalProperties": true
    }
  },
  "x-schemaVersion": "1.0.0"
}
